[
  {
    "name": "Agana",
    "position": {
      "latitude": 13.480570510924,
      "longitude": 144.78375440456,
      "elevation": 258
    },
    "tacan": null,
    "runways": [
      {
        "name": "7",
        "heading": 69,
        "ils": null,
        "length": 4435,
        "width": 148
      },
      {
        "name": "25",
        "heading": 249,
        "ils": null,
        "length": 4435,
        "width": 148
      }
    ],
    "radio": null
  },
  {
    "name": "Airfield 3",
    "position": {
      "latitude": 15.068688009698,
      "longitude": 145.63126613072,
      "elevation": 85
    },
    "tacan": null,
    "runways": [
      {
        "name": "10",
        "heading": 97,
        "ils": null,
        "length": 2485,
        "width": 148
      },
      {
        "name": "28",
        "heading": 277,
        "ils": null,
        "length": 2485,
        "width": 148
      }
    ],
    "radio": null
  },
  {
    "name": "Charon Kanoa",
    "position": {
      "latitude": 15.156407879723,
      "longitude": 145.70281643762,
      "elevation": 11
    },
    "tacan": null,
    "runways": [
      {
        "name": "3",
        "heading": 34,
        "ils": null,
        "length": 3663,
        "width": 148
      },
      {
        "name": "21",
        "heading": 214,
        "ils": null,
        "length": 3663,
        "width": 148
      }
    ],
    "radio": null
  },
  {
    "name": "Gurguan Point",
    "position": {
      "latitude": 15.002242729021,
      "longitude": 145.59428185507,
      "elevation": 280
    },
    "tacan": null,
    "runways": [
      {
        "name": "9",
        "heading": 91,
        "ils": null,
        "length": 3191,
        "width": 148
      },
      {
        "name": "27",
        "heading": 271,
        "ils": null,
        "length": 3191,
        "width": 148
      }
    ],
    "radio": null
  },
  {
    "name": "Isley",
    "position": {
      "latitude": 15.11995904168,
      "longitude": 145.72239915037,
      "elevation": 191
    },
    "tacan": null,
    "runways": [
      {
        "name": "9",
        "heading": 92,
        "ils": null,
        "length": 2663,
        "width": 197
      },
      {
        "name": "27",
        "heading": 272,
        "ils": null,
        "length": 2663,
        "width": 197
      }
    ],
    "radio": null
  },
  {
    "name": "Kagman",
    "position": {
      "latitude": 15.167955482239,
      "longitude": 145.768807509,
      "elevation": 230
    },
    "tacan": null,
    "runways": [
      {
        "name": "9",
        "heading": 91,
        "ils": null,
        "length": 3319,
        "width": 148
      },
      {
        "name": "27",
        "heading": 271,
        "ils": null,
        "length": 3319,
        "width": 148
      }
    ],
    "radio": null
  },
  {
    "name": "Marpi",
    "position": {
      "latitude": 15.28335933455,
      "longitude": 145.80921450329,
      "elevation": 148
    },
    "tacan": null,
    "runways": [
      {
        "name": "11",
        "heading": 113,
        "ils": null,
        "length": 2571,
        "width": 148
      },
      {
        "name": "29",
        "heading": 293,
        "ils": null,
        "length": 2571,
        "width": 148
      }
    ],
    "radio": null
  },
  {
    "name": "Orote",
    "position": {
      "latitude": 13.439825959115,
      "longitude": 144.63358199588,
      "elevation": 82
    },
    "tacan": null,
    "runways": [
      {
        "name": "11",
        "heading": 112,
        "ils": null,
        "length": 4417,
        "width": 148
      },
      {
        "name": "29",
        "heading": 292,
        "ils": null,
        "length": 4417,
        "width": 148
      }
    ],
    "radio": null
  },
  {
    "name": "Pagan",
    "position": {
      "latitude": 18.124433224428,
      "longitude": 145.76196864034,
      "elevation": 49
    },
    "tacan": null,
    "runways": [
      {
        "name": "11",
        "heading": 102,
        "ils": null,
        "length": 2124,
        "width": 66
      },
      {
        "name": "28",
        "heading": 282,
        "ils": null,
        "length": 2124,
        "width": 66
      }
    ],
    "radio": null
  },
  {
    "name": "Rota",
    "position": {
      "latitude": 14.17485135792,
      "longitude": 145.23727951673,
      "elevation": 595
    },
    "tacan": null,
    "runways": [
      {
        "name": "9",
        "heading": 92,
        "ils": null,
        "length": 3374,
        "width": 148
      },
      {
        "name": "27",
        "heading": 272,
        "ils": null,
        "length": 3374,
        "width": 148
      }
    ],
    "radio": null
  },
  {
    "name": "Ushi",
    "position": {
      "latitude": 15.078849654478,
      "longitude": 145.63214123527,
      "elevation": 83
    },
    "tacan": null,
    "runways": [
      {
        "name": "9",
        "heading": 95,
        "ils": null,
        "length": 3232,
        "width": 148
      },
      {
        "name": "28",
        "heading": 275,
        "ils": null,
        "length": 3232,
        "width": 148
      }
    ],
    "radio": null
  }
]
